{
  "capabilityRequirements": {
    "org.kineweave.renderer/presentation": {
      "contractVersion": "^1.0.0",
      "preferredProvider": "org.kineweave.renderer/svg",
      "requiredFeatures": [
        "org.kineweave.presentation/group",
        "org.kineweave.presentation/text",
        "org.kineweave.color/srgb"
      ]
    }
  },
  "documents": {
    "document_main": {
      "documentType": "org.kineweave.standard-motion/composition",
      "path": "documents/main.composition.json",
      "schemaVersion": 1
    }
  },
  "entryDocumentId": "document_main",
  "extensionRequirements": {
    "org.kineweave.standard-motion": {
      "source": {
        "kind": "package",
        "packageName": "@kineweave/standard-motion-document"
      },
      "versionRange": "^0.1.0"
    },
    "org.kineweave.svg-renderer": {
      "source": {
        "kind": "package",
        "packageName": "@kineweave/svg-renderer"
      },
      "versionRange": "^0.1.0"
    }
  },
  "name": "Hello KineWeave",
  "outputProfiles": {
    "svg": {
      "requiredFeatures": [
        "org.kineweave.presentation/group",
        "org.kineweave.presentation/text",
        "org.kineweave.color/srgb"
      ],
      "settings": {},
      "target": "org.kineweave.output/svg"
    }
  },
  "projectFormatVersion": 1,
  "projectId": "project_hello"
}
